[
  {
    "id": "consultants_item_01",
    "assessmentId": "consultants_assessment_01_role_modern_hair_restoration",
    "type": "mcq",
    "prompt": "Which statement best reflects the consultant academy role?",
    "options": [
      { "id": "a", "label": "Confirm the patient diagnosis during the first consultation" },
      { "id": "b", "label": "Support information gathering, education, and handover within scope" },
      { "id": "c", "label": "Set treatment plans independently before doctor review" }
    ],
    "correctAnswer": { "optionIds": ["b"] },
    "modelAnswer": "Support information gathering, education, and handover within scope.",
    "rationale": "The pathway is designed for safe support practice rather than independent diagnosis or planning.",
    "scoringRubric": { "maxScore": 1, "criteria": [{ "id": "c1", "label": "Correct answer", "weight": 1, "guidance": "Select the role-safe option." }] },
    "evidenceTier": "consensus",
    "facultyReviewRequired": false,
    "domainTags": ["ethics-scope"],
    "imageAssetUrl": null
  },
  {
    "id": "consultants_item_02",
    "assessmentId": "consultants_assessment_02_foundations_hair_scalp_science",
    "type": "mcq",
    "prompt": "Why is basic hair and scalp literacy important for consultant teams?",
    "options": [
      { "id": "a", "label": "It allows independent diagnosis" },
      { "id": "b", "label": "It supports accurate communication and handover" },
      { "id": "c", "label": "It replaces the need for clinician review" }
    ],
    "correctAnswer": { "optionIds": ["b"] },
    "modelAnswer": "It supports accurate communication and handover.",
    "rationale": "The purpose is improved patient education and documentation, not diagnostic authority.",
    "scoringRubric": { "maxScore": 1, "criteria": [{ "id": "c2", "label": "Correct answer", "weight": 1, "guidance": "Choose the communication-safe option." }] },
    "evidenceTier": "B",
    "facultyReviewRequired": false,
    "domainTags": ["knowledge"],
    "imageAssetUrl": null
  },
  {
    "id": "consultants_item_03",
    "assessmentId": "consultants_assessment_03_common_hair_loss_presentations",
    "type": "image-interpretation",
    "prompt": "A scalp image appears atypical and the patient reports rapid change. What is the safest next step?",
    "options": [
      { "id": "a", "label": "Reassure the patient that it is likely routine" },
      { "id": "b", "label": "Document neutrally and escalate for clinician review" },
      { "id": "c", "label": "Advise a likely diagnosis based on the image" }
    ],
    "correctAnswer": { "optionIds": ["b"] },
    "modelAnswer": "Document neutrally and escalate for clinician review.",
    "rationale": "Atypical or concerning presentations require escalation rather than reassurance or diagnosis.",
    "scoringRubric": { "maxScore": 1, "criteria": [{ "id": "c3", "label": "Safe escalation choice", "weight": 1, "guidance": "The learner must choose escalation." }] },
    "evidenceTier": "B",
    "facultyReviewRequired": false,
    "domainTags": ["red-flags"],
    "imageAssetUrl": "/images/science/science-hair-cycle.jpg"
  },
  {
    "id": "consultants_item_04",
    "assessmentId": "consultants_assessment_04_consultation_structure_information_gathering",
    "type": "documentation-exercise",
    "prompt": "Write a structured first-consultation note using neutral, standardised headings and no diagnostic claims.",
    "options": [],
    "correctAnswer": { "freeTextSample": "Presenting concern, key history points, expectations, red flags, and handover questions." },
    "modelAnswer": "Structured headings, neutral wording, and clear escalation points should be present.",
    "rationale": "The task tests structure, neutrality, and clinical usefulness.",
    "scoringRubric": { "maxScore": 10, "criteria": [{ "id": "c4", "label": "Documentation structure", "weight": 10, "guidance": "Check structure, neutrality, and handover readiness." }] },
    "evidenceTier": "consensus",
    "facultyReviewRequired": true,
    "domainTags": ["documentation", "communication"],
    "imageAssetUrl": null
  },
  {
    "id": "consultants_item_05",
    "assessmentId": "consultants_assessment_05_candidate_screening_suitability_support",
    "type": "case-triage",
    "prompt": "A patient requests immediate booking but key screening information is incomplete. What is the safest action?",
    "options": [
      { "id": "a", "label": "Proceed and gather the rest later" },
      { "id": "b", "label": "Escalate and complete the missing screening record first" },
      { "id": "c", "label": "Assure them they are probably suitable" }
    ],
    "correctAnswer": { "optionIds": ["b"] },
    "modelAnswer": "Escalate and complete the missing screening record first.",
    "rationale": "Readiness pressure must not override screening and escalation safety.",
    "scoringRubric": { "maxScore": 1, "criteria": [{ "id": "c5", "label": "Safe triage choice", "weight": 1, "guidance": "Escalation and documentation must be selected." }] },
    "evidenceTier": "consensus",
    "facultyReviewRequired": false,
    "domainTags": ["red-flags", "escalation"],
    "imageAssetUrl": null
  },
  {
    "id": "consultants_item_06",
    "assessmentId": "consultants_assessment_06_ethics_consent_scope_of_practice",
    "type": "ethical-judgement",
    "prompt": "A patient asks you whether they are definitely suitable and whether they should sign now. How do you respond?",
    "options": [],
    "correctAnswer": { "freeTextSample": "Clarify role boundaries, support questions, and direct the suitability and consent decision to the doctor." },
    "modelAnswer": "The response should reinforce scope, avoid pressure, and escalate to the doctor for clinical decision-making.",
    "rationale": "Ethics and consent support are tested through safe language and correct boundaries.",
    "scoringRubric": { "maxScore": 10, "criteria": [{ "id": "c6", "label": "Ethical judgement", "weight": 10, "guidance": "Assess scope safety, ethics, and escalation." }] },
    "evidenceTier": "consensus",
    "facultyReviewRequired": true,
    "domainTags": ["ethics-scope"],
    "imageAssetUrl": null
  },
  {
    "id": "consultants_item_07",
    "assessmentId": "consultants_assessment_07_communication_excellence_trust_based_consultation",
    "type": "communication-scenario",
    "prompt": "Draft a response to a hesitant patient who wants certainty before clinician review.",
    "options": [],
    "correctAnswer": { "freeTextSample": "Provide calm, realistic, trust-based language and direct the final clinical decision to the doctor." },
    "modelAnswer": "The response should build trust, avoid pressure, and preserve doctor authority.",
    "rationale": "This task tests communication quality rather than pure recall.",
    "scoringRubric": { "maxScore": 10, "criteria": [{ "id": "c7", "label": "Trust-based communication", "weight": 10, "guidance": "Assess realism, empathy, and scope-safe language." }] },
    "evidenceTier": "consensus",
    "facultyReviewRequired": true,
    "domainTags": ["communication", "ethics-scope"],
    "imageAssetUrl": null
  },
  {
    "id": "consultants_item_08",
    "assessmentId": "consultants_assessment_08_non_surgical_treatment_education",
    "type": "short-answer",
    "prompt": "How should a consultant explain non-surgical options without prescribing?",
    "options": [],
    "correctAnswer": { "freeTextSample": "Explain categories and process, avoid personalised recommendations, and direct specific decisions to the clinician." },
    "modelAnswer": "The learner should explain safely, set expectations, and escalate for personalised advice.",
    "rationale": "The task checks the difference between education and recommendation.",
    "scoringRubric": { "maxScore": 5, "criteria": [{ "id": "c8", "label": "Scope-safe education", "weight": 5, "guidance": "Assess whether the answer avoids prescribing." }] },
    "evidenceTier": "consensus",
    "facultyReviewRequired": false,
    "domainTags": ["communication"],
    "imageAssetUrl": null
  },
  {
    "id": "consultants_item_09",
    "assessmentId": "consultants_assessment_09_surgical_education_for_non_doctors",
    "type": "short-answer",
    "prompt": "What is the safest way to explain the surgical pathway to a patient before doctor review?",
    "options": [],
    "correctAnswer": { "freeTextSample": "Explain the broad process, keep decisions with the doctor, and avoid planning or suitability claims." },
    "modelAnswer": "The learner should focus on process education while preserving doctor authority.",
    "rationale": "This task reinforces boundaries around surgery-related communication.",
    "scoringRubric": { "maxScore": 5, "criteria": [{ "id": "c9", "label": "Bounded surgical education", "weight": 5, "guidance": "Assess pathway explanation and boundary clarity." }] },
    "evidenceTier": "consensus",
    "facultyReviewRequired": false,
    "domainTags": ["ethics-scope", "communication"],
    "imageAssetUrl": null
  },
  {
    "id": "consultants_item_10",
    "assessmentId": "consultants_assessment_10_clinical_photography_documentation_handover",
    "type": "consultation-note",
    "prompt": "Produce a concise handover note for doctor review based on a completed consultation.",
    "options": [],
    "correctAnswer": { "freeTextSample": "A neutral, complete, structured note with red flags and next-step questions." },
    "modelAnswer": "The note should be complete, neutral, and clinically useful.",
    "rationale": "Handover quality is a core advanced competency.",
    "scoringRubric": { "maxScore": 10, "criteria": [{ "id": "c10", "label": "Handover quality", "weight": 10, "guidance": "Assess structure, neutrality, and usefulness." }] },
    "evidenceTier": "consensus",
    "facultyReviewRequired": true,
    "domainTags": ["documentation"],
    "imageAssetUrl": null
  },
  {
    "id": "consultants_item_11",